{"schema_version":"1.0","generated_at":"2026-07-14T11:37:33.531106+00:00","run_id":"local","data":[{"symbol":"RELIANCE","name":"Reliance Industries Ltd.","sector":"Oil & Gas","industry":"Refineries","exchange":"NSE","mcap_cr":1850000,"mcap_category":"Large Cap","close":2945.5,"prev_close":2932.1,"volume":8542310,"volume_avg_20d":7856000,"high_52w":3217.6,"low_52w":2220.3,"returns":{"1D":0.46,"1W":2.15,"2W":3.8,"1M":5.22,"3M":12.4,"6M":18.65,"12M":28.3},"scores":{"momentum":72,"technical":68,"fundamental":81,"sector":65,"volume":70,"risk":55,"composite":71},"recommendation":"BUY","probabilities":{"buy":0.65,"hold":0.25,"sell":0.1},"signals":["breakout","momentum"]},{"symbol":"TCS","name":"Tata Consultancy Services Ltd.","sector":"Information Technology","industry":"IT - Software","exchange":"NSE","mcap_cr":1520000,"mcap_category":"Large Cap","close":4185.3,"prev_close":4192.0,"volume":2145670,"volume_avg_20d":2034000,"high_52w":4592.25,"low_52w":3311.8,"returns":{"1D":-0.16,"1W":0.85,"2W":1.2,"1M":-2.1,"3M":4.5,"6M":8.2,"12M":15.6},"scores":{"momentum":45,"technical":52,"fundamental":88,"sector":58,"volume":42,"risk":72,"composite":58},"recommendation":"HOLD","probabilities":{"buy":0.3,"hold":0.55,"sell":0.15},"signals":[]},{"symbol":"HDFCBANK","name":"HDFC Bank Ltd.","sector":"Financial Services","industry":"Banks - Private","exchange":"NSE","mcap_cr":1380000,"mcap_category":"Large Cap","close":1812.45,"prev_close":1798.3,"volume":12456780,"volume_avg_20d":10234000,"high_52w":1880.0,"low_52w":1363.55,"returns":{"1D":0.79,"1W":3.2,"2W":5.1,"1M":8.45,"3M":15.8,"6M":22.3,"12M":32.1},"scores":{"momentum":82,"technical":78,"fundamental":85,"sector":72,"volume":80,"risk":60,"composite":78},"recommendation":"BUY","probabilities":{"buy":0.72,"hold":0.2,"sell":0.08},"signals":["breakout","momentum","volume"]},{"symbol":"INFY","name":"Infosys Ltd.","sector":"Information Technology","industry":"IT - Software","exchange":"NSE","mcap_cr":680000,"mcap_category":"Large Cap","close":1645.8,"prev_close":1652.4,"volume":5678900,"volume_avg_20d":5123000,"high_52w":1953.9,"low_52w":1358.35,"returns":{"1D":-0.4,"1W":-1.2,"2W":-0.5,"1M":-4.3,"3M":1.2,"6M":5.8,"12M":10.2},"scores":{"momentum":35,"technical":40,"fundamental":82,"sector":50,"volume":48,"risk":68,"composite":48},"recommendation":"HOLD","probabilities":{"buy":0.22,"hold":0.58,"sell":0.2},"signals":[]},{"symbol":"TATAMOTORS","name":"Tata Motors Ltd.","sector":"Automobile","industry":"Auto - Cars & Jeeps","exchange":"NSE","mcap_cr":295000,"mcap_category":"Large Cap","close":812.3,"prev_close":795.6,"volume":18923450,"volume_avg_20d":14567000,"high_52w":882.0,"low_52w":585.2,"returns":{"1D":2.1,"1W":5.4,"2W":8.2,"1M":12.8,"3M":22.5,"6M":35.2,"12M":38.8},"scores":{"momentum":88,"technical":82,"fundamental":65,"sector":78,"volume":85,"risk":42,"composite":76},"recommendation":"BUY","probabilities":{"buy":0.78,"hold":0.15,"sell":0.07},"signals":["breakout","momentum","volume","stage2"]}]}